{
  "$schema": "./schema.json",
  "solLogo": "https://raw.githubusercontent.com/ilyasbozdemir/workdesk-360/main/public/icon.png",
  "sagLogo": "https://upload.wikimedia.org/wikipedia/commons/0/0f/Logo_of_100th_years_of_the_Republic_of_T%C3%BCrkiye.svg",
  "antetSatir1": "SEFERİHİSAR BELEDİYE BAŞKANLIĞI",
  "kurumAdi": "Seferihisar Belediye Başkanlığı",
  "isinAdi": "Belediyemiz Park ve Mesire Alanları Aydınlatma Sistemi Yenileme ve Kablo Çekim Hizmeti",
  "hakedisNo": "2",
  "hakedisTarihi": "24/06/2026",
  "hizmetTutari": "284.500,00",
  "fiyatFarkTutari": "12.350,00",
  "toplamTutar": "296.850,00",
  "iskontoTutari": "0,00",
  "oncekiHakedisTutari": "110.000,00",
  "buHakedisTutari": "186.850,00",
  "kdvOrani": "20",
  "kdvTutari": "37.370,00",
  "tahakkukTutari": "224.220,00",
  "gelirVergisiOrani": "0",
  "gelirVergisiTutari": "0,00",
  "damgaVergisiOrani": "0,00948",
  "damgaVergisiTutari": "1.771,34",
  "kdvTevkifatiOrani": "3/10",
  "kdvTevkifatTutari": "11.211,00",
  "sskKesintisi": "1.250,00",
  "idareMakineKiralari": "0,00",
  "gecikmeCezasi": "0,00",
  "avansMahsubu": "5.000,00",
  "fiyatFarkTeminatKesintisi": "0,00",
  "stopajTutari": "0,00",
  "digerKesinti1Adi": "İhale Kararı Damga Vergisi (Binde 5.69)",
  "digerKesinti1Tutari": "1.063,18",
  "digerKesinti2Adi": "Diğer Kesintiler",
  "digerKesinti2Tutari": "0,00",
  "kesintilerToplamTutari": "20.295,52",
  "odenecekTutar": "203.924,48",
  "notlar": "İkinci hakediş raporudur. Aydınlatma direkleri, kablo montajı ve devreye alma işlerinin şartnameye uygun şekilde tamamlandığı görülmüştür.",
  "yukleniciGoster": true,
  "yukleniciFirma": "Ege Çevre Teknolojileri İnşaat San. ve Tic. Ltd. Şti.",
  "duzenleyen1Adi": "Kemal ÖZTÜRK",
  "duzenleyen1Unvan": "Elektrik Mühendisi",
  "duzenleyen2Adi": "Ayşe GÜLER",
  "duzenleyen2Unvan": "Kontrol Teknikeri",
  "duzenleyen3Adi": "Mustafa YENİCİ",
  "duzenleyen3Unvan": "Fen İşleri Personeli",
  "onayTarihi": "25/06/2026",
  "onaylayanPersonelAdi": "İsmail YETKİN",
  "onaylayanPersonelUnvan": "Belediye Başkanı"
}
